{
  "$schema": "http://json-schema.org/draft-07/schema#",
  "$id": "https://hippotask.dev/schema/1.0.0/hippo-task.schema.json",
  "title": "HippoTask (schema 1.0.0)",
  "x-hippotask-schema-version": "1.0.0",
  "$ref": "#/definitions/HippoTask",
  "definitions": {
    "HippoTask": {
      "type": "object",
      "properties": {
        "id": {
          "type": "string",
          "minLength": 1
        },
        "external_ids": {
          "type": "object",
          "additionalProperties": {
            "type": "string",
            "minLength": 1
          },
          "propertyNames": {
            "minLength": 1
          }
        },
        "title": {
          "type": "string",
          "minLength": 1
        },
        "description": {
          "type": "string"
        },
        "description_format": {
          "type": "string",
          "enum": [
            "markdown",
            "plaintext",
            "html"
          ]
        },
        "status": {
          "type": "string",
          "enum": [
            "backlog",
            "todo",
            "in_progress",
            "in_review",
            "done",
            "cancelled"
          ]
        },
        "status_raw": {
          "type": "string"
        },
        "priority": {
          "type": "string",
          "enum": [
            "none",
            "low",
            "medium",
            "high",
            "urgent"
          ]
        },
        "priority_raw": {
          "anyOf": [
            {
              "type": "string"
            },
            {
              "type": "number"
            }
          ]
        },
        "assignees": {
          "type": "array",
          "items": {
            "type": "object",
            "properties": {
              "id": {
                "type": "string"
              },
              "name": {
                "type": "string"
              },
              "email": {
                "type": "string"
              },
              "external_ids": {
                "type": "object",
                "additionalProperties": {
                  "type": "string",
                  "minLength": 1
                },
                "propertyNames": {
                  "minLength": 1
                }
              }
            },
            "additionalProperties": false
          }
        },
        "creator": {
          "type": "object",
          "properties": {
            "id": {
              "type": "string"
            },
            "name": {
              "type": "string"
            },
            "email": {
              "type": "string"
            },
            "external_ids": {
              "type": "object",
              "additionalProperties": {
                "type": "string",
                "minLength": 1
              },
              "propertyNames": {
                "minLength": 1
              }
            }
          },
          "additionalProperties": false
        },
        "created_at": {
          "type": "string"
        },
        "updated_at": {
          "type": "string"
        },
        "due_date": {
          "type": "string"
        },
        "start_date": {
          "type": "string"
        },
        "completed_at": {
          "type": "string"
        },
        "project_id": {
          "type": "string",
          "minLength": 1
        },
        "parent_id": {
          "type": "string",
          "minLength": 1
        },
        "labels": {
          "type": "array",
          "items": {
            "type": "string",
            "minLength": 1
          }
        },
        "estimate": {
          "type": "number",
          "exclusiveMinimum": 0
        },
        "estimate_unit": {
          "type": "string",
          "enum": [
            "points",
            "hours",
            "minutes"
          ]
        },
        "custom_fields": {
          "type": "object",
          "additionalProperties": {
            "anyOf": [
              {
                "type": "object",
                "properties": {
                  "label": {
                    "type": "string",
                    "minLength": 1
                  },
                  "options": {
                    "type": "array",
                    "items": {
                      "type": "string"
                    }
                  },
                  "type": {
                    "type": "string",
                    "const": "string"
                  },
                  "value": {
                    "type": "string"
                  }
                },
                "required": [
                  "label",
                  "type",
                  "value"
                ],
                "additionalProperties": false
              },
              {
                "type": "object",
                "properties": {
                  "label": {
                    "type": "string",
                    "minLength": 1
                  },
                  "options": {
                    "type": "array",
                    "items": {
                      "type": "string"
                    }
                  },
                  "type": {
                    "type": "string",
                    "const": "number"
                  },
                  "value": {
                    "type": "number"
                  }
                },
                "required": [
                  "label",
                  "type",
                  "value"
                ],
                "additionalProperties": false
              },
              {
                "type": "object",
                "properties": {
                  "label": {
                    "type": "string",
                    "minLength": 1
                  },
                  "options": {
                    "type": "array",
                    "items": {
                      "type": "string"
                    }
                  },
                  "type": {
                    "type": "string",
                    "const": "boolean"
                  },
                  "value": {
                    "type": "boolean"
                  }
                },
                "required": [
                  "label",
                  "type",
                  "value"
                ],
                "additionalProperties": false
              },
              {
                "type": "object",
                "properties": {
                  "label": {
                    "type": "string",
                    "minLength": 1
                  },
                  "options": {
                    "type": "array",
                    "items": {
                      "type": "string"
                    }
                  },
                  "type": {
                    "type": "string",
                    "const": "date"
                  },
                  "value": {
                    "type": "string"
                  }
                },
                "required": [
                  "label",
                  "type",
                  "value"
                ],
                "additionalProperties": false
              },
              {
                "type": "object",
                "properties": {
                  "label": {
                    "type": "string",
                    "minLength": 1
                  },
                  "options": {
                    "type": "array",
                    "items": {
                      "type": "string"
                    }
                  },
                  "type": {
                    "type": "string",
                    "const": "select"
                  },
                  "value": {
                    "type": "string"
                  }
                },
                "required": [
                  "label",
                  "type",
                  "value"
                ],
                "additionalProperties": false
              },
              {
                "type": "object",
                "properties": {
                  "label": {
                    "type": "string",
                    "minLength": 1
                  },
                  "options": {
                    "type": "array",
                    "items": {
                      "type": "string"
                    }
                  },
                  "type": {
                    "type": "string",
                    "const": "multi_select"
                  },
                  "value": {
                    "type": "array",
                    "items": {
                      "type": "string"
                    }
                  }
                },
                "required": [
                  "label",
                  "type",
                  "value"
                ],
                "additionalProperties": false
              },
              {
                "type": "object",
                "properties": {
                  "label": {
                    "type": "string",
                    "minLength": 1
                  },
                  "options": {
                    "type": "array",
                    "items": {
                      "type": "string"
                    }
                  },
                  "type": {
                    "type": "string",
                    "const": "url"
                  },
                  "value": {
                    "type": "string",
                    "minLength": 1
                  }
                },
                "required": [
                  "label",
                  "type",
                  "value"
                ],
                "additionalProperties": false
              },
              {
                "type": "object",
                "properties": {
                  "label": {
                    "type": "string",
                    "minLength": 1
                  },
                  "options": {
                    "type": "array",
                    "items": {
                      "type": "string"
                    }
                  },
                  "type": {
                    "type": "string",
                    "const": "email"
                  },
                  "value": {
                    "type": "string",
                    "minLength": 1
                  }
                },
                "required": [
                  "label",
                  "type",
                  "value"
                ],
                "additionalProperties": false
              },
              {
                "type": "object",
                "properties": {
                  "label": {
                    "type": "string",
                    "minLength": 1
                  },
                  "options": {
                    "type": "array",
                    "items": {
                      "type": "string"
                    }
                  },
                  "type": {
                    "type": "string",
                    "const": "person"
                  },
                  "value": {
                    "type": "object",
                    "properties": {
                      "id": {
                        "type": "string"
                      },
                      "name": {
                        "type": "string"
                      },
                      "email": {
                        "type": "string"
                      },
                      "external_ids": {
                        "type": "object",
                        "additionalProperties": {
                          "type": "string",
                          "minLength": 1
                        },
                        "propertyNames": {
                          "minLength": 1
                        }
                      }
                    },
                    "additionalProperties": false
                  }
                },
                "required": [
                  "label",
                  "type",
                  "value"
                ],
                "additionalProperties": false
              }
            ]
          },
          "propertyNames": {
            "minLength": 1
          }
        },
        "metadata": {
          "type": "object",
          "additionalProperties": {},
          "propertyNames": {
            "minLength": 1
          }
        },
        "schema_version": {
          "type": "string",
          "enum": [
            "1.0.0"
          ]
        }
      },
      "required": [
        "id",
        "title",
        "status",
        "created_at",
        "updated_at",
        "schema_version"
      ],
      "additionalProperties": false
    }
  }
}
